{
  "uits_version": "1.0.0",
  "metadata": {
    "name": "Observe-Learn-Consolidate Flow Map",
    "description": "Tests comprehension of the T1-encoded observe/learn/consolidate pipeline, covering endpoint return values, Hebbian learning triggers, consolidation phases, DBSCAN scaling, and dynamic emergence.",
    "content_type": "architecture_map",
    "tags": [
      "flow",
      "observe",
      "learn",
      "consolidate",
      "hebbian",
      "dbscan"
    ],
    "author": "reh3376"
  },
  "content": {
    "source_file": "docs/architecture/maps/flow_observe_learn_consolidate.md",
    "encoding_format": "t1_coded",
    "injection_context": "Agent working in conversation/learning/hidden layers"
  },
  "ground_truth": {
    "questions": [
      {
        "id": "q1",
        "question": "What does the observe endpoint return?",
        "answer": "obs_id, node_id, surprise_score",
        "difficulty": "factual"
      },
      {
        "id": "q2",
        "question": "What triggers Hebbian learning?",
        "answer": "Co-retrieval activates learning (CO_ACTIVATED_WITH edge creation)",
        "difficulty": "relational"
      },
      {
        "id": "q3",
        "question": "How many phases does the consolidation pipeline have?",
        "answer": "22 phases",
        "difficulty": "factual"
      },
      {
        "id": "q4",
        "question": "What is the DBSCAN eps scaling range across layers?",
        "answer": "0.10 to 0.26",
        "difficulty": "factual"
      },
      {
        "id": "q5",
        "question": "What is Phase 103 in the consolidation pipeline?",
        "answer": "Dynamic emergence \u2014 LLM-named concepts",
        "difficulty": "factual"
      }
    ]
  },
  "scoring_profiles": {
    "active_profile": "arch_map_default",
    "profiles": [
      {
        "profile_id": "arch_map_default",
        "version": "1.0.0",
        "created": "2026-03-24T00:00:00Z",
        "supersedes": null,
        "rationale": "Initial profile \u2014 balanced weights, comprehension-dominant for Jiminy injection use case",
        "weights": {
          "comprehension": 0.4,
          "compaction": 0.25,
          "token_efficiency": 0.2,
          "fidelity": 0.15
        },
        "thresholds": {
          "composite_min": 0.8,
          "comprehension_min": 9.0,
          "comprehension_floor": 7.0,
          "token_max": 250,
          "compaction_min_pct": 30,
          "fidelity_min_pct": 85
        },
        "difficulty_weights": {
          "factual": 0.3,
          "relational": 0.4,
          "inferential": 0.3
        }
      }
    ]
  },
  "thresholds": {
    "composite_min": 0.8,
    "comprehension_min": 9.0,
    "comprehension_floor": 7.0,
    "token_max": 250,
    "compaction_min_pct": 30,
    "fidelity_min_pct": 85
  },
  "optimization": {
    "max_iterations": 5,
    "convergence_window": 2,
    "regeneration_strategy": "manual",
    "model": "gpt-4.1-mini"
  },
  "history": [],
  "config": {
    "sha256": "2bdd3d133079a42a98ca09391b9a13b163abc040e1c5c670a0a79a9b62e8c52d"
  }
}
